### ISSUE TITLE
6.1.0: Taking a long time to connect

### ISSUE THREAD

**Issue by chrishardstaff** [dotnet/SqlClient#3523]
### Describe the bug
When connecting to a remote server, version 6.1.0 is taking significantly longer than 6.0.2

```c#
using Microsoft.Data.SqlClient;

namespace SqlServerConnectTest
{
    internal class Program
    {
        static void Main(string[] args)
        {
            var builder = new SqlConnectionStringBuilder();
            builder.DataSource = "xxx";
            builder.InitialCatalog = "xxx";
            builder.UserID = "xxx";
            builder. Password = "xxx";
            builder.TrustServerCertificate = true;
            builder.ApplicationName = "Connection test";
            builder.ConnectTimeout = 30;
            builder.Encrypt = true;

            Console.WriteLine(builder.ConnectionString);

            using (var cn = new SqlConnection(builder.ConnectionString))
            {
                try
                {
                    var stopwatch = System.Diagnostics.Stopwatch.StartNew();
                    cn.Open();
                    stopwatch.Stop();
                    Console.WriteLine("Connection successful!");
                    Console.WriteLine($"Time taken to connect: {stopwatch.ElapsedMilliseconds} ms");
                }
                catch (SqlException ex)
                {
                    Console.WriteLine($"SQL Error: {ex.Message}");
                }
                catch (Exception ex)
                {
                    Console.WriteLine($"General Error: {ex.Message}");
                }
            }
        }
    }
}

```

When running 6.0.2 on my system this took 948ms, in 6.1.0ms this takes 16494 ms. This is running in .NET 9 and the SQL Server is 2019.

### Expected behavior
The connection should happen in roughly the same time on both versions

**Comment by Wraith2** [comment]
When I test against an azure server.
```
Connection successful!
Time taken to connect: 218 ms
```

connecting to a local sql 2022 instance:
```
Connection successful!
Time taken to connect: 208 ms
```

It might be worth checking your networking to see if there is some stall in name resolution. Try using the ip address and port directly instead of a name for example.

**Comment by pietroserrano** [comment]
I have the same issue with SQL Server 2019 and .NET8.
When running 6.0.2 on my system this took 1040ms, in 6.1.0ms this takes 4494 ms.

**Comment by chenhw** [comment]
> When I test against an azure server.
> 
> ```
> Connection successful!
> Time taken to connect: 218 ms
> ```
> 
> connecting to a local sql 2022 instance:
> 
> ```
> Connection successful!
> Time taken to connect: 208 ms
> ```
> 
> It might be worth checking your networking to see if there is some stall in name resolution. Try using the ip address and port directly instead of a name for example.

No, it has nothing to do with this. I am using the server IP address in the LAN and it takes a long time to connect. It seems to be related to the version of SQL Server.

**Comment by ErikEJ** [comment]
@chenhw Which server version?

**Comment by Wraith2** [comment]
OP says 2019, since I tested on 2022 and am fine it must be a 2019 problem. I don't have 2019 installed, I'd have to build a vm to test it.

**Comment by chrishardstaff** [comment]
This was connecting with an IP address - I will set up a SQL2022 server to test.

**Comment by chrishardstaff** [comment]
I'm getting the same results using a SQL2022 server - this is a remote server, I don't seem to have an issue when connecting to a local database server.

**Comment by ErikEJ** [comment]
@chrishardstaff Do you connect via IP address or DNS name?

**Comment by chrishardstaff** [comment]
@ErikEJ IP address

**Comment by Wraith2** [comment]
A thought. Is your client running on windows or linux? It changes what networking implementation the library uses. I tested on windows which has a native sni component but non-windows use the managed implmentation which can be forced on windows with an appcontext switch.

**Comment by chrishardstaff** [comment]
I'm using windows

**Comment by ErikEJ** [comment]
@chrishardstaff Could you share a (redacted) connection string?

**Comment by chrishardstaff** [comment]
Data Source=xxx.xxx.xxx.xxx;Initial Catalog=database;User ID=user;Password=password;Connect Timeout=30;Encrypt=True;Trust Server Certificate=True;Application Name="Connection test"

**Comment by chrishardstaff** [comment]
I've tried running this same code inside a Linux VM (ubuntu) and it doesn't seem to have the same issue, so if there's a difference between the networking on windows and linux that could be the source of the issue

**Comment by apoorvdeshmukh** [comment]
@chrishardstaff can you try [managed networking mode](https://learn.microsoft.com/en-us/sql/connect/ado-net/appcontext-switches?view=sql-server-ver17#enabling-managed-networking-on-windows) on windows and see if you still face this issue?

**Comment by chrishardstaff** [comment]
@apoorvdeshmukh I'll try it now

**Comment by chrishardstaff** [comment]
@apoorvdeshmukh Setting the managed networking mode in windows fixes the issue

**Comment by ErikEJ** [comment]
@apoorvdeshmukh Wonder if any SNI networking changes were made for 6.1 ?

**Comment by apoorvdeshmukh** [comment]
@ErikEJ Yes, I am checking that. This issue could not be reproduced with Azure SQL instance with native networking mode.
@chrishardstaff Can you tell us the network hops required to reach the remote server using [tracert](https://www.geeksforgeeks.org/techtips/how-to-use-the-tracert-traceroute-command-in-windows/)? We will try reproducing this issue using similar setup.

**Comment by chrishardstaff** [comment]
Hi,

I've removed the IP addresses:

```
Tracing route to ???.???.???.??? over a maximum of 30 hops

  1    <1 ms    <1 ms    <1 ms  XXX.XXX.XXX [???.???.???.???]
  2    10 ms    10 ms     9 ms  ???.???.???.???
```

The set up here is that we have a site-to-site VPN with Azure, and the SQL server is running on an Azure VM. I'll try set something up on a network internally to test.

**Comment by cheenamalhotra** [comment]
@chrishardstaff do you have an update?

**Comment by suhrab** [comment]
I also have the same issue
OS Windows Server 2022
SQL Server 2022
Connection string: Server=10.11.115.1;Database=xxx;User ID=xxx;Password=xxx;Encrypt=False;

I tried differen version of Microsoft.Data.SqlClient
7.0 Preview - Timeout
6.1.1 - Timeout
6.0.2 - OK


Workarounds that helped:
1. Downgrade to version 6.0.2
2. AppContext.SetSwitch("Switch.Microsoft.Data.SqlClient.UseManagedNetworkingOnWindows", true);
3. Increase Connect Timeout to 30 seconds. 


FYI I also tried to connect to SQL Server from localhost with 6.1.1. It works fine without any workarounds. So the problem is when connecting to remote SQL host.

**Comment by a1ex2k** [comment]
Some investigations.

**SQL Server 2019 (TLSv1.2)**
Connection string = `server = tcp:10.10.10.254,1433; database = [redacted]; User Id = [redacted]; Password = [redacted]; Encrypt=False;`
SqlClientSql v5.4.6 and any newer, everything is fine both with and without `AppContext.SetSwitch("Switch.Microsoft.Data.SqlClient.UseManagedNetworkingOnWindows", true);` switch.

**SQL Server 2008 (TLSv1)**
Connection string = `server = tcp:192.168.6.254,1433; database = [redacted]; User Id = [redacted]; Password = [redacted]; Encrypt=False;`
SqlClient v <= 6.0.4 is fine but newer ones don't work as expected:
- enabling ManagedNetworking, make it immediately throw `Microsoft.Data.SqlClient.SqlException: 'A connection was successfully established with the server, but then an error occurred during the login process. (provider: TCP Provider, error: 0 - The operation completed successfully.)'`
- using native one, make it wait for 11 seconds. Here is what WireShark shows:
```
62	4.703311	192.168.6.254	192.168.7.116	TCP	66	1433 → 57065 [SYN, ACK] Seq=0 Ack=1 Win=8192 Len=0 MSS=1460 WS=256 SACK_PERM
63	4.703390	192.168.7.116	192.168.6.254	TCP	54	57065 → 1433 [ACK] Seq=1 Ack=1 Win=262656 Len=0
61	4.700135	192.168.7.116	192.168.6.254	TCP	66	57065 → 1433 [SYN] Seq=0 Win=64240 Len=0 MSS=1460 WS=256 SACK_PERM
230	15.814698	192.168.7.116	192.168.6.254	TDS	148	TDS7 pre-login message
231	15.817737	192.168.6.254	192.168.7.116	TDS	97	Response
```

Can't upgrade to EFCore 10.0.0 on .NET 10 because of dependency `>= 6.1.1`

**Comment by cheenamalhotra** [comment]
Newer versions of MDS don't support out of support versions of SQL Server, view support matrix here: 

https://learn.microsoft.com/en-us/sql/connect/ado-net/sqlclient-driver-support-lifecycle?view=sql-server-ver17#sql-version-compatibility-with-microsoftdatasqlclient

**Comment by cheenamalhotra** [comment]
Could someone confirm if this issue is also reproducible for SQL 2016 or later or an Azure instance?

**Comment by cxjke** [comment]
The issue is definitely real. We were forced to upgrade to 6.1.3 due to the .NET 10 EF Core libraries requiring >= 6.1.1. When connecting to an SQL Server 2019 or 2022 we experience the issue in our products.
Regarding your question @cheenamalhotra : Didn't https://github.com/dotnet/SqlClient/issues/3804 basically confirm at least the 2016 part?

**Comment by apoorvdeshmukh** [comment]
Hi, we finally have a setup which consistently reproduces this issue. We are actively working on the fix and will post updates once this is fixed. Thank you for the patience.

**Comment by apoorvdeshmukh** [comment]
Can someone validate if the [linked PR](https://github.com/dotnet/SqlClient/pull/3929) fixes the issue seen here?
